Session ID,State,Ideas,Started,Goal
11979171534120099471,SUCCEEDED,104,2025-09-29 21:12,"Develop novel and highly effective methods for early cancer detection using biomarkers, aiming to significantly improve patient outcomes and save lives through earlier diagnosis and intervention."
11717670767947535533,NO_INSTANCE,0,2025-09-29 16:09,
17036277309618455762,NO_INSTANCE,0,2025-09-29 20:44,
2331780263718009802,NO_INSTANCE,0,2025-09-29 20:50,
3813428866428369009,NO_INSTANCE,0,2025-09-29 20:47,
4539858058950764911,NO_INSTANCE,0,2025-09-29 20:43,
10209222854608066649,CREATING,0,2025-09-17 20:12,Develop a comprehensive strategy to significantly reduce medication errors in pediatric emergency departments by integrating improved workflow processes and advanced technology solutions.
1058741341851676949,CREATING,0,2025-09-18 14:21,"Develop innovative and actionable strategies to significantly enhance the clinical effectiveness, integration, and adoption of advanced hemodynamic monitoring systems leveraging predictive algorithms (e.g., Hypotension Prediction Index), ultimately leading to improved patient safety and clinical outcomes."
1093642605992412918,CREATING,0,2025-09-17 19:12,"Develop an innovative strategy or solution that significantly reduces the duration and severity of intraoperative hypotension in patients undergoing elective abdominal surgery, by enhancing the effectiveness of advanced hemodynamic monitoring and predictive algorithms."
11046846894672440147,CREATING,0,2025-09-26 18:02,"Generate a groundbreaking, AI-powered solution designed to substantially decrease hospital readmission rates, thereby enhancing patient care quality and optimizing healthcare resource utilization."
11291598873880247784,CREATING,0,2025-09-17 20:16,"Generate concrete, actionable ideas aimed at significantly reducing medication errors within pediatric emergency departments, ultimately leading to improved patient safety and better healthcare outcomes for children."
11700099847376519712,CREATING,0,2025-09-26 18:31,"Develop innovative and effective methods for the early, pre-symptomatic or prodromal, detection of Alzheimer's disease to enable timely intervention and significantly improve patient outcomes."
11751210875933757316,CREATING,0,2025-09-17 19:20,"Develop innovative and effective virtual reality therapy interventions to significantly reduce acute pain and anxiety experienced by burn patients during wound care procedures, ultimately improving patient comfort, compliance, and overall recovery outcomes."
11803580663690898469,CREATING,0,2025-09-17 20:16,"Develop an AI system to proactively identify early signs of sepsis in Intensive Care Unit (ICU) patients, enabling timely clinical interventions and significantly improving patient outcomes by reducing morbidity and mortality."
12032698589341510028,CREATING,0,2025-09-19 18:02,"Propose novel research ideas to advance the field of API performance monitoring and testing, identifying gaps, new methodologies, or innovative tools that lead to more robust and efficient API ecosystems."
1251549517643438119,CREATING,0,2025-09-19 17:01,"Develop innovative, AI-powered strategies to significantly decrease hospital readmission rates, thereby improving patient care, reducing healthcare burdens, and optimizing resource utilization."
12534645360977947991,CREATING,0,2025-09-29 21:16,"Propose a comprehensive, AI/ML-driven framework that significantly reduces the incidence of hospital-acquired infections by leveraging real-time patient, environmental, and historical data to enable proactive intervention strategies."
12864926055651026175,CREATING,0,2025-09-17 20:16,"Develop an innovative and highly accurate AI system capable of proactively identifying sepsis onset in critically ill ICU patients, thereby enabling timely intervention, improving patient outcomes, and reducing mortality rates."
12887741511481505011,CREATING,0,2025-09-29 16:50,"Develop a detailed and actionable AI/ML framework that integrates real-time patient monitoring, environmental sensor data, and historical infection patterns to accurately predict the risk of hospital-acquired infections (HAIs) for individual patients and proactively implement preventive measures across a healthcare facility, ultimately reducing HAI incidence and improving patient safety."
12936450720513212179,CREATING,0,2025-09-18 14:40,"Propose a novel machine learning-driven approach for the early and accurate detection of sepsis in Intensive Care Unit (ICU) patients, leveraging continuous physiological monitoring data to enable timely intervention, improve patient outcomes, and reduce mortality rates."
12977269452114035454,CREATING,0,2025-09-19 18:20,"Propose a groundbreaking method for the early detection of cancer using specific biomarkers, significantly enhancing diagnostic accuracy and leading to earlier patient intervention and improved survival rates."
13252688888244263986,CREATING,0,2025-09-18 15:46,"Generate a novel, effective, and clinically implementable machine learning approach for early sepsis detection in ICU patients, leveraging continuous monitoring data to improve patient outcomes and reduce mortality."
13444933344628557657,CREATING,0,2025-09-19 18:14,"Propose a novel, AI-driven approach that significantly reduces preventable hospital readmission rates, improving patient outcomes and healthcare system efficiency."
14188866779729792475,CREATING,0,2025-09-17 20:11,"Develop a novel, highly accurate, and clinically actionable machine learning-based approach for the early detection of sepsis in ICU patients, leading to improved patient outcomes and reduced mortality."
14315848291471091186,CREATING,0,2025-09-17 02:20,"To develop and implement innovative strategies that significantly reduce the duration and severity of intraoperative hypotension in patients undergoing elective abdominal surgery, by enhancing the effectiveness of advanced hemodynamic monitoring coupled with predictive algorithms."
14315848291471091799,CREATING,0,2025-09-17 02:21,"Propose an innovative solution designed to significantly enhance the effectiveness of advanced hemodynamic monitoring systems, particularly those utilizing predictive algorithms like the Hypotension Prediction Index, with the ultimate objective of reducing both the duration and severity of intraoperative hypotension in patients undergoing elective abdominal surgery."
14400489654375446870,CREATING,0,2025-09-17 20:10,"Develop a novel machine learning-driven approach for the early and accurate detection of sepsis in ICU patients, significantly improving patient outcomes and reducing mortality."
14604017831360959788,CREATING,0,2025-09-17 19:45,"Generate innovative, actionable ideas to significantly enhance the clinical effectiveness and positive patient impact of advanced hemodynamic monitoring systems that integrate predictive algorithms (e.g., Hypotension Prediction Index), leading to proactive clinical interventions and improved patient outcomes."
14703683039085883673,CREATING,0,2025-09-17 19:13,"Generate a single, innovative, and clinically applicable idea that significantly enhances the effectiveness of advanced hemodynamic monitoring, especially when integrated with predictive algorithms, to proactively and demonstrably decrease both the duration and severity of intraoperative hypotension in patients undergoing elective abdominal surgery, thereby leading to improved patient safety and clinical outcomes."
147994496799664806,CREATING,0,2025-09-18 15:46,"Propose a novel, robust, and secure method for session ID retrieval that improves upon existing techniques in terms of security, performance, and applicability across various modern web and mobile application architectures."
15356213960122170608,CREATING,0,2025-09-19 18:02,"Propose a novel, scientifically sound, and potentially implementable approach for the earliest possible detection of Alzheimer's disease, aiming to enable timely intervention and improve patient outcomes."
15927424994922471441,CREATING,0,2025-09-19 18:03,"Propose an innovative and implementable solution that significantly reduces the incidence of surgical site infections (SSIs) across diverse surgical settings, improving patient outcomes and healthcare efficiency."
16082547733828256569,CREATING,0,2025-09-17 20:13,"Propose a novel and effective intervention strategy to significantly improve hand hygiene adherence among healthcare workers in hospital settings, ultimately reducing healthcare-associated infections."
16373935967978322018,CREATING,0,2025-09-17 20:14,"Propose effective, evidence-based interventions designed to significantly improve hand hygiene adherence among healthcare workers in hospital settings, ultimately reducing healthcare-associated infections."
1659621192157931383,CREATING,0,2025-09-29 16:07,Develop innovative AI-driven solutions to significantly decrease hospital readmission rates and improve patient outcomes.
16728429822366532620,CREATING,0,2025-09-19 17:18,"Design a groundbreaking AI-driven solution that demonstrably decreases hospital readmission rates, thereby enhancing patient care continuity, improving long-term health outcomes, and optimizing healthcare resource utilization."
17482017875465641480,CREATING,0,2025-09-29 16:49,"Develop a novel and highly effective method for the early detection of cancer using specific biomarkers, with the ultimate aim of significantly improving patient prognosis and survival rates."
2048130443388034576,CREATING,0,2025-09-17 20:14,"Propose a novel, impactful, and clearly defined research question in statistics that contributes significantly to theoretical knowledge or offers practical solutions to real-world problems."
2186848198030052895,CREATING,0,2025-09-11 21:09,"Improve clinical outcomes by significantly reducing the duration and severity of intraoperative hypotension in elective abdominal surgery patients, leveraging advanced hemodynamic monitoring and predictive algorithms."
2331282853079952278,CREATING,0,2025-09-18 20:16,Propose a novel and impactful research direction or technical approach for effectively retrieving session information in complex or distributed system architectures.
2599390752549549817,CREATING,0,2025-09-17 19:15,"Generate a novel and actionable idea aimed at significantly reducing both the duration and severity of intraoperative hypotension (IOH) in patients undergoing elective abdominal surgery, by effectively leveraging advanced hemodynamic monitoring and predictive algorithms."
3200862633613196477,CREATING,0,2025-09-17 20:09,"Propose a concrete and actionable idea that significantly enhances the effectiveness and clinical utility of advanced hemodynamic monitoring systems integrated with predictive algorithms, leading to improved patient outcomes and more efficient clinical workflows."
3545070705744965267,CREATING,0,2025-09-18 20:20,"Generate a novel research idea focused on improving the accuracy, efficiency, or scalability of instance-level information retrieval and verification."
3556029543947986415,CREATING,0,2025-09-11 21:02,"To significantly reduce the duration and severity of intraoperative hypotension in patients undergoing elective abdominal surgery by enhancing the effectiveness of advanced hemodynamic monitoring and predictive algorithms, ultimately improving patient outcomes and safety."
404053637141684090,CREATING,0,2025-09-17 20:10,"Develop a novel, robust, and clinically deployable machine learning framework that analyzes continuous patient monitoring data in real-time to enable significantly earlier and more accurate detection of sepsis in Intensive Care Unit (ICU) patients, thereby dramatically improving patient survival rates and reducing healthcare burden."
4808636279503860787,CREATING,0,2025-09-17 19:16,"Develop a singular, innovative strategy, system, or enhancement that significantly improves the effectiveness of advanced hemodynamic monitoring and predictive algorithms (such as HPI) to demonstrably reduce the duration and severity of intraoperative hypotension in patients undergoing elective abdominal surgery, thereby improving patient outcomes and safety."
4808722660755442936,CREATING,0,2025-09-18 15:52,Develop novel and impactful research ideas focused on advancing the state-of-the-art in instance information retrieval and its subsequent verification.
504242727029761212,CREATING,0,2025-09-17 20:17,"Generate comprehensive and actionable research proposals designed to rigorously investigate the effectiveness of virtual reality therapy in mitigating pain experienced by burn patients during their wound care procedures, ultimately aiming to establish evidence-based guidelines for clinical application."
6014096779869576453,CREATING,0,2025-09-26 17:43,"Propose a concrete, actionable, and novel AI-driven solution designed to significantly reduce hospital readmission rates, thereby enhancing patient care and optimizing healthcare system efficiency."
6461593523257961886,CREATING,0,2025-09-18 14:21,"Develop innovative and practical solutions to significantly enhance the clinical effectiveness, integration, and utility of advanced hemodynamic monitoring coupled with predictive algorithms (like HPI), leading to earlier, more accurate interventions and improved patient outcomes."
